{
  "$schema": "https://json-schema.org/draft/2020-12/schema",
  "$id": "https://github.com/SamGu-NRX/house-scanning/server/schemas/result.schema.json",
  "title": "Battery placement result",
  "description": "The placement server's answer for one scene (contract C2). Lengths are in feet; plan coordinates [x, z] and s follow scene.schema.json. The result settles placement only, never the whole installation: electrical checks (panel, meter) are outside it.",
  "type": "object",
  "additionalProperties": false,
  "required": ["schema_version", "decision", "summary", "reasons", "policy", "spot", "route", "checks", "missing_evidence", "ends", "sweep", "stats"],
  "properties": {
    "schema_version": {"const": "1.0"},
    "decision": {
      "enum": ["pass", "manual_review", "reject"],
      "description": "pass: a fully observed spot passes every check under an approved policy. manual_review: a person must decide, because the best spot has an UNSURE check, the policy is not approved for automatic decisions, or an area that could hold a valid spot was not seen. reject: every spot within reach fails by a clear margin, and both ends of the walk are known."
    },
    "summary": {"type": "string", "description": "One sentence for the homeowner or reviewer."},
    "reasons": {
      "type": "array",
      "items": {
        "type": "object",
        "additionalProperties": false,
        "required": ["code", "message"],
        "properties": {
          "code": {
            "enum": ["all_checks_pass", "policy_not_approved", "unsure_checks", "unobserved_area", "unexplored_end", "all_spots_fail", "no_wall_segment_fits"]
          },
          "message": {"type": "string"},
          "checks": {"type": "array", "items": {"type": "string"}, "description": "Check ids behind this reason."}
        }
      }
    },
    "policy": {
      "type": "object",
      "additionalProperties": false,
      "required": ["id", "version", "auto_approve", "sources", "rules_sha256"],
      "properties": {
        "id": {"type": ["string", "null"]},
        "version": {"type": ["string", "null"]},
        "auto_approve": {"type": "boolean", "description": "Whether the rules allow automatic decisions: false when no policy is selected or the rules set auto_approve false (the public strict policy does, because some values are placeholders; the public demo policy decides anyway and says so in notice). When false, every would-be pass or reject becomes manual_review. Each check's rule.placeholder says which values decided it."},
        "sources": {"type": "array", "items": {"enum": ["public", "private"]}, "description": "Which rules files were loaded."},
        "rules_sha256": {"type": "string", "pattern": "^[0-9a-f]{64}$", "description": "Hash of the merged rules the decision used."},
        "notice": {"type": ["string", "null"], "description": "Whose rules these are, to show with the answer, for example that the public demo policy is not Base's. Null for rules that need no such label."}
      }
    },
    "spot": {
      "description": "The chosen battery position: the best passing spot, or for manual_review the best spot with no failing check. Null when no such spot exists, including every reject.",
      "oneOf": [{"type": "null"}, {"$ref": "#/$defs/spot"}]
    },
    "route": {
      "description": "Cable route from the meter to the chosen spot. Null when `spot` is null.",
      "oneOf": [{"type": "null"}, {"$ref": "#/$defs/route"}]
    },
    "checks": {
      "description": "Every check at the chosen spot, or, when `spot` is null, at `nearest_considered`.",
      "type": "array",
      "items": {"$ref": "#/$defs/check"}
    },
    "nearest_considered": {
      "description": "When `spot` is null: the evaluated spot closest to passing (fewest failing checks, then fewest unsure, then shortest route), whose checks explain why it fails. Null otherwise.",
      "oneOf": [{"type": "null"}, {"$ref": "#/$defs/spot"}]
    },
    "missing_evidence": {
      "description": "Views that would settle an UNSURE result. Only areas nobody observed appear here; an UNSURE caused by a measurement inside its error band needs a person, not more photos. Empty for pass and reject. Supplying exactly what a band request names settles it: a coverage.observed entry with the same band and span_ft, and out_ft at least the request's out_ft.",
      "type": "array",
      "items": {
        "type": "object",
        "additionalProperties": false,
        "required": ["kind", "message"],
        "properties": {
          "kind": {"enum": ["band", "past_end"]},
          "band": {"enum": ["wall", "ground", "overhead", "facing"]},
          "span_ft": {"$ref": "#/$defs/span"},
          "out_ft": {"type": "number", "minimum": 0, "description": "For ground, facing, overhead and wall requests: how far the view must reach, out from the wall (ground, facing) or up from the ground (overhead, wall). Report it as the observed entry's out_ft; seeing further also settles it."},
          "side": {"enum": ["left", "right"]},
          "checks": {"type": "array", "items": {"type": "string"}},
          "message": {"type": "string"}
        }
      }
    },
    "ends": {
      "type": "object",
      "additionalProperties": false,
      "required": ["left", "right"],
      "properties": {
        "left": {"$ref": "#/$defs/end"},
        "right": {"$ref": "#/$defs/end"}
      }
    },
    "sweep": {
      "description": "Outcome of every battery start position along the wall, merged into runs of equal outcome. Shows why each stretch fails; the site plan colours the wall with it.",
      "type": "array",
      "items": {
        "type": "object",
        "additionalProperties": false,
        "required": ["wall_id", "start_ft", "outcome", "failing", "unsure"],
        "properties": {
          "wall_id": {"type": "string"},
          "segment": {"type": "integer", "minimum": 0, "description": "Straight baseline segment of `wall_id`; runs never cross a corner."},
          "start_ft": {"$ref": "#/$defs/span", "description": "Range of battery start positions (left edge, in s) in this run. Stretches too far along the wall for any cable route are one failing run, not evaluated start by start."},
          "outcome": {"$ref": "#/$defs/outcome"},
          "failing": {"type": "array", "items": {"type": "string"}},
          "unsure": {"type": "array", "items": {"type": "string"}}
        }
      }
    },
    "stats": {
      "type": "object",
      "additionalProperties": false,
      "required": ["candidates", "pass", "unsure", "fail", "elapsed_ms", "input_sha256"],
      "properties": {
        "candidates": {"type": "integer", "minimum": 0},
        "pass": {"type": "integer", "minimum": 0},
        "unsure": {"type": "integer", "minimum": 0},
        "fail": {"type": "integer", "minimum": 0},
        "elapsed_ms": {"type": "number", "minimum": 0},
        "input_sha256": {"type": "string", "pattern": "^[0-9a-f]{64}$", "description": "Hash of the scene JSON as uploaded."}
      }
    }
  },
  "$defs": {
    "point2": {"type": "array", "minItems": 2, "maxItems": 2, "items": {"type": "number"}},
    "span": {"type": "array", "minItems": 2, "maxItems": 2, "items": {"type": "number"}},
    "outcome": {"enum": ["pass", "fail", "unsure"]},
    "end": {
      "type": "object",
      "additionalProperties": false,
      "required": ["kind", "s_ft", "point"],
      "properties": {
        "kind": {"enum": ["limit", "unexplored"]},
        "s_ft": {"type": "number", "description": "Where the wall chain ends, in s."},
        "point": {"$ref": "#/$defs/point2"},
        "beyond_reach": {"type": "boolean", "description": "True when this end is so far along the wall that no spot past it could pass the route-length check, so an unexplored end there does not block a reject."}
      }
    },
    "check": {
      "type": "object",
      "additionalProperties": false,
      "required": ["id", "label", "outcome", "reason", "measured_ft", "plus_minus_ft", "threshold_ft", "comparison", "rule"],
      "properties": {
        "id": {"type": "string", "description": "Stable identifier, for example gas_clearance or route_length."},
        "label": {"type": "string"},
        "outcome": {"$ref": "#/$defs/outcome"},
        "unsure_cause": {
          "enum": ["margin", "unobserved", "unknown_attribute", "rule_requires_review"],
          "description": "Only for unsure. margin: measured inside the error band, a person must judge. unobserved: the deciding area was not seen, more photos fix it. unknown_attribute: a fact the camera did not establish (for example whether a window opens). rule_requires_review: the policy sends this situation to a person (for example a cable routed over a door)."
        },
        "reason": {"type": "string"},
        "measured_ft": {"type": ["number", "null"], "description": "The deciding measurement, for example the gap to the nearest gas meter. Null when nothing relevant was found or it was not observed."},
        "plus_minus_ft": {"type": ["number", "null"]},
        "threshold_ft": {"type": ["number", "null"]},
        "review_threshold_ft": {"type": "number", "description": "Present on checks with a review band (route_length): a value that doesn't clear this line (at_most: measured + error < review_threshold_ft) is at best unsure, even when it clears threshold_ft. Same convention as the scoring harness's review_threshold."},
        "comparison": {"enum": ["at_least", "at_most", null], "description": "at_least: pass needs measured - error > threshold. at_most: pass needs measured + error < threshold."},
        "subject": {"type": ["string", "null"], "description": "What the measurement is to, for example \"objects[2] gas_meter\"."},
        "rule": {
          "type": "object",
          "additionalProperties": false,
          "required": ["key", "source", "placeholder"],
          "properties": {
            "key": {"type": "string", "description": "Parameter name in rules.yaml."},
            "source": {"type": "string", "description": "Citation for the value."},
            "placeholder": {"type": "boolean", "description": "True for a demo value with no public source."}
          }
        }
      }
    },
    "spot": {
      "type": "object",
      "additionalProperties": false,
      "required": ["outcome", "wall_id", "segment", "span_ft", "width_ft", "depth_ft", "height_ft", "footprint", "center", "along", "outward", "meter_offset_ft", "route_length_ft"],
      "properties": {
        "outcome": {"$ref": "#/$defs/outcome"},
        "wall_id": {"type": "string"},
        "segment": {"type": "integer", "minimum": 0, "description": "Index of the straight baseline segment of `wall_id` the battery backs onto."},
        "span_ft": {"$ref": "#/$defs/span", "description": "Battery's stretch of wall in s, left edge first."},
        "width_ft": {"type": "number"},
        "depth_ft": {"type": "number"},
        "height_ft": {"type": "number"},
        "footprint": {"type": "array", "minItems": 4, "maxItems": 4, "items": {"$ref": "#/$defs/point2"}, "description": "Plan corners [x, z]: back-left, back-right, front-right, front-left."},
        "center": {"$ref": "#/$defs/point2", "description": "Plan centre of the footprint."},
        "along": {"$ref": "#/$defs/point2", "description": "Unit vector along the wall toward +s."},
        "outward": {"$ref": "#/$defs/point2", "description": "Unit vector from the wall out toward the battery's front."},
        "meter_offset_ft": {
          "type": "array", "minItems": 2, "maxItems": 2, "items": {"type": "number"},
          "description": "Footprint centre minus the meter's plan position, [dx, dz] in the scene frame's axes. scene.json carries no ground height, so the app sets the height by resting the box on its detected ground plane. Attach AR content to the meter's anchor with this offset, rotated by the anchor's orientation if the anchor is not axis-aligned with the scene frame."
        },
        "route_length_ft": {"type": ["number", "null"]}
      }
    },
    "route": {
      "type": "object",
      "additionalProperties": false,
      "required": ["outcome", "length_ft", "plus_minus_ft", "height_ft", "polyline", "detours", "crossings"],
      "properties": {
        "outcome": {"$ref": "#/$defs/outcome"},
        "length_ft": {"type": "number", "description": "Length along the supported wall from the meter to the battery's near edge, including detours around wall objects."},
        "plus_minus_ft": {"type": "number"},
        "height_ft": {"type": "number", "description": "Height above ground the cable runs at, from the rules."},
        "polyline": {"type": "array", "items": {"$ref": "#/$defs/point2"}, "description": "Plan points from the meter along the wall to the battery."},
        "detours": {
          "type": "array",
          "items": {
            "type": "object",
            "additionalProperties": false,
            "required": ["subject", "extra_ft"],
            "properties": {"subject": {"type": "string"}, "extra_ft": {"type": "number"}}
          }
        },
        "crossings": {
          "type": "array",
          "items": {
            "type": "object",
            "additionalProperties": false,
            "required": ["subject", "span_ft", "effect"],
            "properties": {
              "subject": {"type": "string"},
              "span_ft": {"$ref": "#/$defs/span"},
              "effect": {"enum": ["fail", "review", "detour", "allow"]}
            }
          }
        }
      }
    }
  }
}
